star,start_thai,detail_short,detail_long
Nobleman,วันพลังเกื้อหนุน,เป็นวันที่พลังของจักรวาลอยู่ข้างคุณ เหมือนมีผู้ใหญ่ใจดี หรือใครสักคนบนฟ้าคอยช่วยดันหลังอยู่เงียบๆ เป็นวันที่คุณได้รับโอกาส มีพลังพิเศษเกื้อหนุนคุณอยู่,"มันคือวันที่ พลังของจักรวาลอยู่ข้างคุณ เหมือนมีผู้ใหญ่ใจดี หรือใครสักคนบนฟ้าคอยช่วยดันหลังอยู่เงียบๆ เป็นวันที่คุณได้รับโอกาส

ในวันแบบนี้ ขอเพียงคุณ กล้าคิด กล้าขอ กล้าลงมือ
ชีวิตอาจเปลี่ยนไปอย่างที่คุณไม่เคยคาดคิด

วันพลังเกื้อหนุนเหมาะกับอะไรบ้าง?

นัดคุยเรื่องงาน สำคัญๆ

ขอความช่วยเหลือ เจรจา ขอโอกาส

เริ่มสิ่งใหม่ เปิดตัวโปรเจกต์ ลงทุนเบาๆ

ขอพร ตั้งจิตดีๆ เชื่อว่าเรามีค่าพอจะได้รับ

แค่คุณรู้ว่าวันไหนเป็น “วันพลังเกื้อหนุน” และ ใช้มันอย่างตั้งใจ
คุณจะประหลาดใจว่าชีวิตมันเบาขึ้นได้แค่ไหน เพราะพลังที่คุณมองไม่เห็นอยู่ข้างคุณ"
Peach blossom,วันพลังเสน่ห์,เป็นวันที่พลังรอบตัวกระตุ้นแรงดึงดูดในตัวคุณให้ส่องแสงออกมาแบบธรรมชาติ คนจะเปิดใจให้คุณง่ายขึ้น จะทำให้คุณดูน่ารัก คนเห็นคนเอ็นดู มีออร่าพิเศษเหมือนมีสปอตไลท์ส่วนตัวโดยไม่ต้องพยายามเลย,"วันที่พลังรอบตัวกระตุ้นแรงดึงดูดในตัวคุณให้ส่องแสงออกมาแบบธรรมชาติ

แล้วพลังแบบนี้เอาไปใช้อะไรได้บ้างล่ะ?

เรื่องงาน:
ใช้วันพลังเสน่ห์เพื่อนำเสนองาน เจรจา หรืองานขายอะไรก็ตามที่ต้องการ “ความเชื่อใจ” และ “การยอมรับ” เพราะคนจะเปิดใจให้คุณง่ายขึ้น เหมาะกับการสร้าง ""คอนเนคชั่น"" อย่างมาก

เรื่องความรัก:
ถ้าโสด นี่แหละโอกาสดี! ออกไปพบปะ พูดคุย ทำความรู้จัก
ถ้ามีคู่ ก็ใช้วันนี้เติมเสน่ห์ใส่กันใหม่อีกครั้ง

ชีวิตประจำวัน:
พลังของวันนี้จะทำให้คุณดูน่ารัก คนเห็นคนเอ็นดู มีออร่าพิเศษเหมือนมีสปอตไลท์ส่วนตัวโดยไม่ต้องพยายามเลย

ใช้เสน่ห์เป็นพลังบวก ใช้เพื่อสร้างความสุข ความสัมพันธ์ และโอกาสที่ดีให้กับชีวิตคุณ
"
Heavenly virtue,วันแห่งเมตตา คลี่คลายความขัดแย้ง,เป็นวันที่พลังงานรอบตัวส่งเสริมให้ เกิดการให้อภัย การเข้าใจ และการเยียวยาใจ เหมือนฟ้าอยากให้เรื่องยุ่งๆ ได้จบลงอย่างร่มเย็น,"วันที่ใจเย็นลง...และโลกก็อ่อนโยนขึ้น

บางวันในชีวิต เหมือนมีพลังบางอย่างที่ทำให้เรา “เบากว่าเดิม”
ความขัดแย้ง ปัญหาต้องเคลียร์ใจ
ความตึงเครียด...เริ่มอ่อนนุ่มลง

วันที่พลังงานรอบตัวส่งเสริมให้ เกิดการให้อภัย การเข้าใจ และการเยียวยาใจ เหมือนฟ้าอยากให้เรื่องยุ่งๆ ได้จบลงอย่างร่มเย็น

พลังของวันนี้เหมาะกับอะไรบ้าง?

ในเรื่องงาน:
เหมาะกับการเคลียร์ใจในทีม ประชุมเรื่องค้างคา หรือเจรจาสิ่งที่เคยยืดเยื้อ
ถ้าคุณเป็นผู้นำ วันนี้คือโอกาสทองในการใช้ “พลังนุ่ม” แทนคำสั่ง 

ในเรื่องความรัก:
ใช้วันนี้เพื่อลดช่องว่าง พูดคุย เปิดใจ หรือขอโทษกัน
ถ้าความสัมพันธ์เริ่มห่าง วันแบบนี้ช่วยเชื่อมใจให้กลับมาใกล้กันอีกครั้ง

ในชีวิตประจำวัน:
ใช้วันนี้เคลียร์ปัญหา ข้อพิพาท คดีความ วันนี้ยังเหมาะกับการติดต่อหน่วยงาน พูดคุยกับญาติ หรือเคลียร์ปัญหาส่วนตัว แม้แต่การขอความช่วยเหลือ ก็มีแนวโน้มได้รับการตอบรับอย่างดี

ในวันแห่งเมตตา อย่าใช้พลังนี้เพื่อ “เอาชนะ”
แต่ใช้มันเพื่อ “เข้าใจ และให้อภัย”"
Fortune virtue,วันฟ้าเปิดดวงรับพร,เป็นวันที่บุญหนุนนำ เปิดโชคลาภ ความมั่งคั่ง วันที่พลังดีๆ พาคุณไปเจอโอกาสที่ดีเกินคาด วันนี้คุณยิ่งให้คุณยิ่งได้,"เป็นวันที่บุญหนุนนำ เปิดโชคลาภ ความมั่งคั่ง วันที่พลังดีๆ พาคุณไปเจอโอกาสที่เกินคาด

คนช่วยเหลือแบบไม่ต้องขอ งานที่รอคำตอบกลับกลายเป็นข่าวดี
หรือแม้แต่เงินที่เคยคิดว่าไม่มา ก็โผล่มาแบบปาฏิหาริย์

นั่นแหละคือพลังของ “วันบุญหนุนนำ”
วันที่บุญเก่าเปิดทาง โชคลาภค่อยๆ เดินเข้ามาแบบเงียบๆ
คุณไม่ต้องวิ่งหาโชค แค่เปิดใจ…โชคก็หาคุณเอง


วันนี้เหมาะกับอะไรบ้าง?

งานและธุรกิจ
ใช้วันนี้นัดเจรจา เปิดร้านใหม่ เซ็นสัญญา หรือเริ่มต้นโปรเจกต์ที่หวังผลตอบแทน ถ้ามีอะไรที่ต้อง “ขอความไว้วางใจ” หรือ “ต้องการให้เงินไหลมา” วันแบบนี้เหมาะที่สุด

เรื่องเงินและทรัพย์สิน
เหมาะกับการออกรถ ลงทุนเบาๆ ติดต่อธนาคาร หรือเจรจาเรื่องเงิน
โอกาสจะมาแบบที่คุณรู้สึกว่า “ฟ้าก็ช่วยเราเหมือนกันแฮะ”

เรื่องความรักและชีวิตประจำวัน
เป็นวันเบาสบาย คนที่อยู่ใกล้คุณจะรู้สึกดี มีเสน่ห์แบบธรรมชาติ
ถ้าได้ไปทำบุญร่วมกัน หรือแบ่งปันอะไรเล็กๆ จะยิ่งเสริมพลังบุญให้ยิ่งหนุนชีวิตมากขึ้น

สิ่งสำคัญที่ควรทำในวันนี้:

ตั้งใจให้ดี อารมณ์ดีไว้ ยิ้มบ่อยๆ
และอย่าลืม “ให้ก่อน” ไม่ว่าจะเป็นคำดีๆ หรือช่วยคนรอบตัวเล็กๆ น้อยๆ
เพราะพลังของวันนี้คือ ให้แล้วได้กลับมากกว่าเดิม"
Clash,วันพลังตีกลับ ชีวิตไม่ลงล็อค,พลังวันนี้สวนทางกับพลังงานส่วนตัวของคุณ ส่งผลให้รู้สึกไม่ราบรื่น อารมณ์แปรปรวน หรือเกิดเหตุการณ์ไม่คาดคิด ซึ่งอาจไม่ถึงขั้นร้ายแรง แต่ก็ทำให้รู้สึก “ไม่สมูธ” ได้ วันนี้เป็นจังหวะที่ต้องเบาและเตรียมตั้งรับ,"เป็นวันที่พลังตีกลับ ใจเราต้องนิ่งกว่าปกติ

บางวันรู้สึกแปลก ๆ ทั้งที่ทุกอย่างก็ดูปกติ
อยู่เฉย ๆ ก็มีเรื่องเข้ามา คุยกันก็คลาดเคลื่อนง่าย เหมือนพลังรอบตัว “ชน” เข้ากับพลังในตัวเรา

นั่นแหละ…คือพลังของ “วันชง”
ไม่ได้แปลว่าต้องมีเรื่องร้ายแรง แต่เป็นสัญญาณเตือนว่า ""วันนี้...ใจต้องนิ่งขึ้นอีกนิด""

แล้ววันแบบนี้ส่งผลยังไง?
อารมณ์จะไวและเปราะบาง คุยกับใครให้ฟังจนจบก่อนตอบ งานอาจเปลี่ยนแผนกะทันหัน หรือมีของร้อนโยนมาให้ คนใกล้ตัวอาจพูดไม่เข้าหู...อย่าเก็บมาคิดเยอะ บางคนอาจรู้สึก “วันนี้มันไม่เหมือนเดิม” ทั้งที่ดูเหมือนเดิม

เพราะมันคือวันพลัง “ตีลังกา” แบบเบา ๆ

แล้วเราควรทำยังไงดี?
ลดความคาดหวังกับคนอื่นลง แล้วจะเบาขึ้นเยอะ อย่าตอบโต้ด้วยอารมณ์ ใช้ “ความนิ่ง” เป็นเกราะป้องกัน ไม่ต้องฝืนเฮฮาหรือขยันเกินไป แค่รักษาพลังให้ นิ่งและมั่นคง ถ้ารู้สึกอยากปลดปล่อย ลอง จัดบ้าน บริจาคของ หรือทำบุญเล็ก ๆ ถ้ามีเรื่องค้างคาใจ อย่าเพิ่งเคลียร์วันนี้ รอวันที่พลังเบากว่านี้

วันชงไม่ใช่วันซวย
แต่คือวันที่จักรวาลส่งเสียงแผ่ว ๆ มาบอกว่า
“วันนี้...ขอให้ใจคุณเบาลงอีกนิดก็พอ”

แค่รู้ทัน ก็รับมือได้ครึ่งหนึ่งแล้ว"